{
  "schema_version": "1.0",
  "kind": "memory_chain",
  "id": "team-governance",
  "title": "Team governance context chain",
  "description": "Minimum governance context to retrieve before cross-role decisions.",
  "scope": "team",
  "memory_ids": ["governance-owner-boundaries"],
  "tags": ["governance", "ownership"],
  "created_at": "2026-09-06T00:00:00Z",
  "updated_at": "2026-09-06T00:00:00Z"
}

